ID;Nome;Filmes;Genero;Mensagem Personalizada;Filmes Sugeridos
1;Joăo Silva;;Ficçăo Científica;Olá Joăo! Que tal mergulhar em mais filmes que desafiam a mente? Boas sessőes!;Tenet, Blade Runner 2049
2;Maria Souza;;Romance;Olá Maria! Adorou dramas românticos? Que tal estas sugestőes para sua próxima sessăo?;A Star Is Born, La La Land
3;Carlos Lima;;Açăo;Olá, Carlos! Para sua dose de super-heróis, que tal continuar com estas sugestőes?;Vingadores: Era de Ultron, Doutor Estranho
4;Ana Pereira;;Terror;Ana, adoro seu gosto por terror! Que tal estas duas opçőes para arrepiar de vez?;A Freira, Sobrenatural
5;Lucas Santos;;Animaçăo;Oi Lucas! Para continuar a diversăo, que tal essas aventuras animadas?;Monstros S.A., Kung Fu Panda
